title,company,location,date
Chief Software Engineer Head of Edge Systems & Fleet Management,Anduril Industries,Seattle,2026-03-18
Senior Strategic Support Specialist,Datacor,"Remote, US",2026-03-18
Senior Software Engineer Identity,Peregrine Technologies,"Washington, D.C.",2026-03-18
DevOps Database Assistant Vice President,iCapital,Salt Lake City,2026-03-18
Senior Sales Systems Engineer,Veeam Software,Massachusetts,2026-03-18
Senior Sales Engineer Data & AI Security,Veeam Software,"Saint Louis, MO, USA",2026-03-18
Electrical Engineer,Central Moloney,Pine Bluff,2026-03-18
Data Center Site Start Up Manager,Serverfarm,"Remote, USA",2026-03-18
