title,company,location,date
National Account Manager Footwear,ARC&#39;TERYX,"New York, NY",2026-04-10
E01 HR Compliance Specialist IV,EXPANSIA,Remote,2026-04-10
Senior Emulation Engineer,EnCharge AI,India,2026-04-10
Mixed Signal IC Layout Design Engineer,Tenstorrent,North America,2026-04-10
Principal Design System Designer,Twin Health,USA,2026-04-10
Software Engineering Manager I Mobile,Stone,Remoto,2026-04-10
Team Lead Corporate Accounting,Lightspeed Commerce,Montreal,2026-04-10
Senior Data Engineer,Thoughtworks,Chicago,2026-04-10
Intermediate Gameplay Software Engineer,Blackbird Interactive,Vancouver,2026-04-10
Manager Product Development,C1,San Francisco,2026-04-10
Staff Engineer Digital Lending,OakNorth,London,2026-04-10
Director of Security Engineering,C1,Portland,2026-04-10
