title,company,location,date
Senior Staff Engineer Product Security,Faire,"San Francisco, CA",2026-03-20
Principal Machine Learning Engineer,Attentive,United States,2026-03-20
Data Scientist Subscriptions,Spotify,"New York, NY",2026-03-20
Junior Manual QA Engineer,Topstep,United States,2026-03-20
Customer Service Booking Hotels We Will Train You,Destination Knot,"Dallas, Texas",2026-03-20
Business Development Representative East Coast Only,Qualio,North America,2026-03-20
Poker Room Manager,Bellota Labs,"Redwood City, CA",2026-03-20
Software Engineer Reliability,OpenAI,San Francisco,2026-03-20
Senior Product Manager AI Products,Boostlingo,United States,2026-03-20
SaaS Platform Architect,Legion,United States,2026-03-20
AD Vehicle Integration Manager,MOIA,Wolfsburg,2026-03-20
V&V Specialist V&V Manager,MOIA,Wolfsburg,2026-03-20
Chief Software Engineer Head of Edge Systems & Fleet Management,Anduril Industries,Seattle,2026-03-20
