title,company,location,date
Test,JAKSON Group,"Noida, ",2026-06-06
Customer Support Advocate,Tithe.ly,"Remote, ",2026-06-06
Data Entry Specialist,Bendigo Advertiser,"Bar Beach, ",2026-06-06
Onboarding Specialist,ezCater,"United States, ",2026-06-06
Customer Success Manager,Gifted,"United States, ",2026-06-06
Data Entry Specialist Assistant Administrator,RecruitLytic Hires,"횠짠횢혙횢혚횠짱횢혡횢혛횠짤, 횠짠횢혙횢혚횠짱횢혡횢혛횠짤 횠짠횢혙횢혚횠짱횢혡횢혛횠짤 횠짠횢혙횠쨀횠쨔횢혞횠짱횢혡횠짤",2026-06-06
File Clerk,RecruitLytic Hires,"횠짙횠짢횢혞 횠쨍횠짢횢혡, 횠짙횠짢횢혞 횠쨍횠짢횢혡 횠짙횠짢횢혞 횠쨍횠짢횢혡 횠짠횢혙횠짜횢혚횠짠횠짹횠짠횠짧 횠짠횢혙횠쨔횠짹횠짢횢혡횠짤 횠짠횢혙횢혚횠짧횠짯횠짱횠짤",2026-06-06
Customer Support,RecruitLytic Hires,"횠짙횠짢횢혞 횠쨍횠짢횢혡, 횠짙횠짢횢혞 횠쨍횠짢횢혡 횠짙횠짢횢혞 횠쨍횠짢횢혡 횠짠횢혙횠짜횢혚횠짠횠짹횠짠횠짧 횠짠횢혙횠쨔횠짹횠짢횢혡횠짤 횠짠횢혙횢혚횠짧횠짯횠짱횠짤",2026-06-06
Freelance Video Editor,Forbes Advisor,"London, London, England, United Kingdom",2026-06-06
Entry Level Administrative Assistant,RecruitLytic Hires,"횠짠횢혙횢혚횠짱횢혡횢혛횠짤, 횠짠횢혙횢혚횠짱횢혡횢혛횠짤 횠짠횢혙횢혚횠짱횢혡횢혛횠짤 횠짠횢혙횠쨀횠쨔횢혞횠짱횢혡횠짤",2026-06-06
Forecast Analyst,REI,"Seattle, Seattle, Washington, United States",2026-06-06
Associate,Buyers Blueprint,"Greater Adelaide Area, ",2026-06-06
Care Coordinator,SonderMind,"Dallas, Dallas, Texas, United States",2026-06-06
Docentes de licenciatura online UANE,Lottus Education,"Saltillo, Saltillo, Coahuila de Zaragoza, M횄짤xico",2026-06-06
Data Entry,Ryz Labs,"Arkansas, Arkansas, United States",2026-06-06
Learning &amp; Development Specialist,Nestl횄짤 Health Science,"Brooklyn, ",2026-06-06
Influencer Marketing Coordinator,Newhouse,"Ciudad de M횄짤xico, Ciudad de M횄짤xico, M횄짤xico",2026-06-06
Freelance Video Editor,Forbes Advisor,"Wilmington, Wilmington, England, United Kingdom",2026-06-06
Asst Depot Manager,Unilever,"Gurgaon, Gurgaon, Haryana, India",2026-06-06
