title,company,location,date
Forward Deployed Engineer VoIP,Parloa,New York,2026-03-21
Senior Staff Software Engineer AI Customer Operations,Monzo,"Cardiff, London",2026-03-21
Customer Support Specialist,HighLevel,Remote,2026-03-21
Lead Product Designer,Alpaca,Remote - Canada - LATAM,2026-03-21
Senior Staff Engineer Product Security,Faire,"San Francisco, CA",2026-03-21
Principal Machine Learning Engineer,Attentive,United States,2026-03-21
Data Scientist Subscriptions,Spotify,"New York, NY",2026-03-21
Junior Manual QA Engineer,Topstep,United States,2026-03-21
Customer Service Booking Hotels We Will Train You,Destination Knot,"Dallas, Texas",2026-03-21
Business Development Representative East Coast Only,Qualio,North America,2026-03-21
Poker Room Manager,Bellota Labs,"Redwood City, CA",2026-03-21
