title,company,location,date
Human Resources Assistant,Recruit Lytics Hires,"England, England, United Kingdom",2026-06-23
Entry Level Administrative Assistant,Recruit Lytics Hires,"脴搂脵聞脵聟脴炉脵聤脵聠脴漏, 脴搂脵聞脵聟脴炉脵聤脵聠脴漏 脴搂脵聞脵聟脴炉脵聤脵聠脴漏 脴搂脵聞脴鲁脴鹿脵聢脴炉脵聤脴漏",2026-06-23
Data Entry Specialist Assistant Administrator,Recruit Lytics Hires,"Hong Kong, Hong Kong, Hong Kong SAR",2026-06-23
Virtual Executive Assistant,Recruit Lytics Hires,"Friesland, Friesland, Nederland",2026-06-23
Marketing Coordinator,Blackstone Talent Group,Los Angeles Metropolitan Area,2026-06-23
Director of Credit Risk,Made Card,New York City,2026-06-23
Area Sales Manager Chicago,Garage Beer,"Chicago, Chicago, Illinois, United States",2026-06-23
Area Sales Manager Michigan,Garage Beer,"Detroit, Detroit, Michigan, United States",2026-06-23
Digital Marketing Designer,Format,"Toronto, Toronto, Ontario, Canada",2026-06-23
Junior Supply Chain Analyst,Helic & Co,"United States, ",2026-06-23
Executive Assistant,Virtana Corp.,"United States, ",2026-06-23
Hiring For Air Ticketing Executive Ground Staff,MILLENNIUM GLOBAL SERVICE,"Thiruvananthapuram, ",2026-06-23
Outside Sales Representative,Omada.ai,Eugene,2026-06-23
Operations Roles,Edirq,"Ya芒聙聶ngamdo, ",2026-06-23
忙聳掳氓陋聮盲陆聯猫驴聬猫聬楼莽潞驴盲赂,氓陇搂盲录聴忙卤陆猫陆娄茂录聢盲赂颅氓聸陆茂录聣,"猫聥聫氓路聻, ",2026-06-23
茫聙聬猫驴聹莽篓聥莽潞驴盲赂聤茫聙聭忙聳掳氓陋聮盲陆聯猫驴聬猫聬,氓陇搂盲录聴忙卤陆猫陆娄茂录聢盲赂颅氓聸陆茂录聣,"忙聺颅氓路聻, ",2026-06-23
