title,company,location,date
Principal Solution Architect Professional Services Finance,Anaplan,Minneapolis,2026-03-28
Senior Technical Success Manager,New Relic,Bangalore,2026-03-28
Senior Talent Acquisition Coordinator,New Relic,Hyderabad,2026-03-28
Studio Manager,"Vox Media, LLC","New York, New York",2026-03-28
Senior Product Manager Checkout & Post Booking,Tripadvisor,POL Virtual,2026-03-28
Outbound Account Executive US,Amplemarket,"Remote, US",2026-03-28
Senior Developer Backend Search CD+E,Ubiminds,Remote,2026-03-28
Interior Designer,Bold Business,"India, Philippines",2026-03-28
Strategic Account Executive,Zip,Stockholm,2026-03-28
Lead Security Engineer,Copia Automation,New York City,2026-03-28
Fire Protection Engineer,Skillcloud HCM,"Portland, Maine",2026-03-28
Compensation Analyst,BHG Financial,Remote,2026-03-28
Mid Market Customer Account Manager,Iterable,REMOTE - US,2026-03-28
