title,company,location,date
Implementation Specialist,LaunchBrightly,,2026-04-15
Sr Software Engineer B E,"Rebuy, Inc.",,2026-04-15
Senior Product Designer Product Design UX,Ubiminds,Remote,2026-04-15
Engineering Manager Data Platform,TrueML,Remote in USA,2026-04-15
Independent Mental Health Therapist New Mexico,Ascend Healthcare,New Mexico,2026-04-15
Product Manager,WorkOS,San Francisco,2026-04-15
Vice President Client Success West,EnableComp,"Franklin, TN",2026-04-15
Product Manager Market Platform,Voltus,Remote,2026-04-15
Principal Care Management Care Coordinator,MTC Care,,2026-04-15
Customer Success Associate,Workera AI,Remote,2026-04-15
Senior Software Engineer II Applied AI and Evaluations,Smartsheet,,2026-04-15
Customer Success Manager II,Renaissance Learning North America,IL,2026-04-15
Inside Sales Specialist Lead Manager,House Buyers of America,Remote,2026-04-15
Senior Cloud Architect ML AI,DoiT,,2026-04-15
HONK Client Success Manager,HONK,,2026-04-15
Director of Strategic Accounts Food Service &amp; Alt Channels,Skinny Dipped,USA,2026-04-15
Content Operations Coordinator,Colibri Group,United States,2026-04-15
Provider Success Manager,Regard,,2026-04-15
Senior IAM Engineer,IonQ,"Bothell, Washington, United States; Boulder, Colorado, United States; College Park, Maryland, United States; Remote, US",2026-04-15
Machine Learning Engineer,Radformation,,2026-04-15
