title,company,location,date
Clinical Psychologist,LifeStance Health,"Crofton, MD",2026-03-30
Head of Finance North America,Adyen,San Francisco,2026-03-30
Manager of Revenue Operations,LatamCent,,2026-03-30
Product Security Manager,MoonPay,United States (East Coast Time Zone) - Remote,2026-03-30
Applied Computational Nutrition Scientist,WISEcode,United States,2026-03-30
Staff Machine Learning Engineer,Fullscript,,2026-03-30
Cloud Security Engineer,MoonPay,,2026-03-30
Recruiting Coordinator Temporary,SpaceX,"Hawthorne, CA",2026-03-30
Senior Security Engineer Automation,MoonPay,,2026-03-30
Clinician Experience Specialist,Nabla,New York City,2026-03-30
Content &amp; Training Manager,Fi,"New York, NY",2026-03-30
Staff Software Engineer Platform,SmithRx,,2026-03-30
Senior Staff Data Engineer,SmithRx,Remote,2026-03-30
AI Data Specialist,micro1,,2026-03-30
Engenharia Software Engineer III Golang Elixir,Stone,Remoto,2026-03-30
Salesforce Technical Consultant,Hunt St,,2026-03-30
Nurse Practitioner Weekdays 9 00am 6 00pm PST Telehealth Primary Care,Curai,Remote,2026-03-30
Senior Software Engineer C++ Windows SDK WIN32 API,Ivanti,Hyderabad,2026-03-30
Senior Backend Engineer Integrations,Arbiter AI,New York City,2026-03-30
Product Marketing Manager Ecommerce,GetResponse,,2026-03-30
