title,company,location,date
Associate Forward Deployed Engineer,Symmetry Systems,Remote,2026-04-06
Senior Site Civil Engineer Land Development,"ms consultants, inc.",,2026-04-06
Senior UX UI designer,GoMining,,2026-04-06
Legal Counsel AI Trainer Freelance 8 20 hrs week,10x Team,Bucharest,2026-04-06
Senior Sales Development Representative,Huzzle,,2026-04-06
Website Maintenance,CrewBloom,,2026-04-06
Lead Consultant Public Sector,Celonis,Washington DC,2026-04-06
Product Manager Energy Storage Controls & Telemetry,Verse,"San Francisco, CA",2026-04-06
Sales Development Representative,Huzzle,,2026-04-06
Senior Strategist Future of Work & AI Readiness,American Institutes for Research,,2026-04-06
Customs Compliance Consultant,Reachdesk Ltd,London,2026-04-06
Senior Backend Engineer HyperDX,ClickHouse,United States,2026-04-06
Strategic Core Account Executive CPG Databricks,Databricks,Ohio,2026-04-06
Intermediate Full Stack Engineer,Runn,,2026-04-06
Senior Full Stack Engineer,Runn,,2026-04-06
Banner Consultant Student Accounts Receivable,Strata Information Group,Remote,2026-04-06
Accounting Intern,SpecterOps,,2026-04-06
Senior Engagement Manager,Medallion,Remote,2026-04-06
Forward deployed Engineer LatAm,Clara,Latin America,2026-04-06
Internship Marketing Summer 2026,Concentric,Seattle,2026-04-06
