title,company,location,date
Junior Mid Full Stack Software Engineer,Black Canyon Consulting,Bethesda,2026-05-04
Work From Home Bilingual Client Services Representative,Global Elite Empire Consultants,"San Diego, California",2026-05-04
Social Media Growth Lead,Black &amp; White Zebra,,2026-05-04
Data Conversion Developer,Grant Street Group,United States (Remote),2026-05-04
Director of Supply Chain,STR,Remote,2026-05-04
Account Executive,BlastPoint,,2026-05-04
Clinical Vendor Activation Manager,Care Access,USA Remote,2026-05-04
Intelligence Collections Specialist UK,Concentric,Hereford,2026-05-04
Crisis Care Manager,Imagine Pediatrics,Remote,2026-05-04
Triage Medical Assistant,Apex Skin,,2026-05-04
GO virtual tutor,GO Tutor Corps,,2026-05-04
Lead Analytics Engineer Borrowing,Monzo,"Cardiff, London",2026-05-04
Maps Visual Design Relevance Rater English,Welo Global,United States,2026-05-04
Solutions Analyst,Sayari,,2026-05-04
Lead Analytics Engineer Borrowing,Monzo,"Cardiff, London",2026-05-04
Account Executive Branded Merchandise Promotional Products,Reachdesk Ltd,Atlanta,2026-05-04
Patient Navigator,Imagine Pediatrics,,2026-05-04
Entry Level Crypto Market Specialist,Infiniti Group,,2026-05-04
Senior Data Engineer,Business Wire,,2026-05-04
Digital Full Stack Engineer HR172,Smart Working Solutions,,2026-05-04
