title,company,location,date
Become a Student Life Coach Flexible Role UK £20 £40 hr,FindTutors,,2026-06-17
Startup Investment & Strategy Specialist,CapitexAI,,2026-06-17
Founding Designer,Leap,"San Francisco, San Francisco, California, United States",2026-06-17
Venture Capital & Startup Investment Expert,CapitexAI,,2026-06-17
FP&A Analyst,CapitexAI,,2026-06-17
North America Field Marketing and Events Manager,Rithum,United States,2026-06-17
Talent Acquisition Partner,Peak Credit Union,Remote,2026-06-17
DevSecOps Engineer,TrueML,"Lenexa, Kansas",2026-06-17
Senior Product Manager,Distru,Remote,2026-06-17
Application Support Associate,TurningPoint Healthcare Solutions,"Florida, Florida, United States",2026-06-17
Research Analyst,Gritter Francona,"Washington, Washington, District of Columbia, United States",2026-06-17
Marketing Assistant,Sleek Marketing,"England, England, United Kingdom",2026-06-17
Junior Business &amp; Data Analyst,"Upgrade, Inc.","San Francisco, San Francisco, California, United States",2026-06-17
Communications Associate,Discord,San Francisco Bay Area,2026-06-17
Pharmacology Research Specialist,STEM Sync AI,,2026-06-17
Graphic Designer,The Fountain Group,"San Francisco, San Francisco, California, United States",2026-06-17
Medical Scribe,Angel City VA Recruitment,,2026-06-17
Director National Accounts,Recess,Cincinnati Metropolitan Area,2026-06-17
Academic School Mentor &amp; After School Guidance &amp; Flexible Role £20 £40 hr,FindTutors,"London, London, England, United Kingdom",2026-06-17
Junior Front End Developer,Work Force Nexus,"Remote, ",2026-06-17
