title,company,location,date
Sales Development Representative,UpGuard,,2026-04-09
Alumni Relationship Manager Casablanca,ALX Africa,Casablanca,2026-04-09
Benefits Manager,"Instructure, Inc.",,2026-04-09
Staff Software Engineer CRM LATAM,Luxury Presence,Latin America,2026-04-09
Payroll Operations and Systems Manager,Arbor Education,,2026-04-09
User Acquisition Specialist,Hyperlab,,2026-04-09
Senior front end developer,Expatfile.tax,,2026-04-09
Crypto Trader,Fox GLobal Assets,,2026-04-09
Product Manager Data Management &amp; Platform,HHAeXchange,United States,2026-04-09
Client Support Specialist,TrueML,Remote in USA,2026-04-09
English Contract Attorney,"Contact Government Services, LLC",,2026-04-09
Sales Development Representative,Pushpay,,2026-04-09
Fraud Waste and Abuse Data Analyst,HHAeXchange,United States,2026-04-09
Regional Manager,Clearway Energy,,2026-04-09
RevOps AI Analyst Intern,Actian Corporation,US-Remote,2026-04-09
Associate Forward Deployed Engineer,Symmetry Systems,Remote,2026-04-09
Senior Site Civil Engineer Land Development,"ms consultants, inc.",,2026-04-09
Senior UX UI designer,GoMining,,2026-04-09
Legal Counsel AI Trainer Freelance 8 20 hrs week,10x Team,Bucharest,2026-04-09
Senior Sales Development Representative,Huzzle,,2026-04-09
